input_file_name	gene_symbol	gene_name	reference_database_id	reference_database_version	reference_accession	analysis_software_name	analysis_software_version	sequence_identity	input_sequence_id	input_protein_start	input_protein_stop	input_gene_start	input_gene_stop	reference_protein_start	reference_protein_stop	reference_gene_start	reference_gene_stop	strand_orientation	coverage_depth	coverage_percentage	coverage_ratio	reference_gene_length	reference_protein_length	input_gene_length	input_protein_length	drug_class	antimicrobial_agent	resistance_mechanism
sampleA	mcr-1.1	phosphoethanolamine--lipid A transferase MCR-1.1	NCBI Reference Gene Database	2021-09-30.1	WP_049589868.1	amrfinderplus	3.10.16	100.0	contig00002			314	1936					+		100.0			541		541	COLISTIN	COLISTIN	
sampleA	blaCTX-M-55	class A extended-spectrum beta-lactamase CTX-M-55	NCBI Reference Gene Database	2021-09-30.1	WP_015387340.1	amrfinderplus	3.10.16	100.0	contig00004			18162	19034					+		100.0			291		291	BETA-LACTAM	CEPHALOSPORIN	
sampleA	blaTEM-1	class A broad-spectrum beta-lactamase TEM-1	NCBI Reference Gene Database	2021-09-30.1	WP_000027057.1	amrfinderplus	3.10.16	100.0	contig00008			1226	2083					+		100.0			286		286	BETA-LACTAM	BETA-LACTAM	
sampleA	aph(6)-Id	aminoglycoside O-phosphotransferase APH(6)-Id	NCBI Reference Gene Database	2021-09-30.1	WP_000480972.1	amrfinderplus	3.10.16	100.0	contig00008			2320	3153					-		100.0			278		278	AMINOGLYCOSIDE	STREPTOMYCIN	
sampleA	aph(3'')-Ib	aminoglycoside O-phosphotransferase APH(3'')-Ib	NCBI Reference Gene Database	2021-09-30.1	WP_109545041.1	amrfinderplus	3.10.16	99.64	contig00008			3156	3980					-		100.0			275		275	AMINOGLYCOSIDE	STREPTOMYCIN	
sampleA	sul2	sulfonamide-resistant dihydropteroate synthase Sul2	NCBI Reference Gene Database	2021-09-30.1	WP_001043260.1	amrfinderplus	3.10.16	99.63	contig00008			4020	4832					-		100.0			271		271	SULFONAMIDE	SULFONAMIDE	
sampleA	tet(A)	tetracycline efflux MFS transporter Tet(A)	NCBI Reference Gene Database	2021-09-30.1	WP_000804064.1	amrfinderplus	3.10.16	99.75	contig00009			2732	3928					+		100.0			399		399	TETRACYCLINE	TETRACYCLINE	
sampleA	dfrA14	trimethoprim-resistant dihydrofolate reductase DfrA14	NCBI Reference Gene Database	2021-09-30.1	WP_004201280.1	amrfinderplus	3.10.16	100.0	contig00012			136	606					-		100.0			157		157	TRIMETHOPRIM	TRIMETHOPRIM	
